<?xml version="1.0" encoding="UTF-8"?>
<imdb xmlns:xsi="http://www.w3.org/2001/XMLSchema-instance" xsi:noNamespaceSchemaLocation="imdb.xsd">
    <settings
        sleepSecondsMin="20"
        sleepSecondsMax="30"
        debug="false"
    />
    <title
        preferredLanguage="default"
        useOriginalIfExists="true">
        
    </title>
    
    <searchUrl><![CDATA[https://www.imdb.com/find?s=tt&q=%%TITLE%%]]></searchUrl>
    
    <datePatterns>
        <pattern><![CDATA[dd MMM yyyy]]></pattern>
        <pattern><![CDATA[dd MMM. yyyy]]></pattern>
        <pattern><![CDATA[dd MMMM yyyy]]></pattern>
        <pattern><![CDATA[MMM. dd, yyyy]]></pattern>
        <pattern><![CDATA[yyyy-MM-dd]]></pattern>
    </datePatterns>
</imdb>
